 Chosen one!, ¡Elegida!
"Oh! Well, welcome to Vault City, Captain.","¡Oh! De acuerdo, bienvenida a Ciudad Refugio, capitán."
"Oh! You must be one of the Servants assigned here for the day. You should... uh, hmmm. YOU - GO - MARTIN.","¡Oh! Debes ser una de los siervos asignados aquí hoy. Deberías... uh, hmmm. TÚ - VE CON - MARTIN."
Oh! You're the new Citizen. Welcome to Vault City.,¡Oh! Eres la nueva Ciudadana. Bienvenida a Ciudad Refugio.
"Oh, I'm sorry. I certainly didn't mean to be rude. I'll be leaving now. Goodbye.","Oh, lo siento. No quise ser grosera. Ya me voy. Adiós."
"Oh, a joke. Hardy har har har. Now, are you my new master or not?","Oh, una broma. Ja Ja Ja. Ahora, ¿eres mi nueva ama o no?"
"Oh, gee, you're my hero. Now PISS OFF.","Oh, caramba eres mi heroína. Y ahora VETE A LA MIERDA."
"Oh, good. An idiot. Touched by the radiation, eh, pal? I can't understand you. I can't help you.","Oh, bien. Una idiota. Afectado por la radiación, ¿eh, amiga? No puedo entenderte. No puedo ayudarte."
"Oh, is that so? Look, I don't know who you are, but you're no Citizen. Give me those papers and get out of here. You want in, you're going to have to get a Day Pass from Wallace like everyone else.","Oh, ¿es así? Mira, no sé quién eres, pero no eres Ciudadana. Dame esos documentos y sal de aquí. Si quieres entrar, tendrás que conseguir de Wallace un pase de día, como todo el mundo."
"Oh, is that your face?","Oh, ¿eres tan fea?"
"Oh, look - the goody two-shoes, lollipop kid. Boys, escort this hypocritical paragon of saintly virtue out of my sight!","Oh, mira: una buenaza que ayuda a cruzar la calle a las ancianitas. ¡Muchachos, escoltad a este hipócrita modelo de virtud santificada fuera de mi vista!"
"Oh, look, it's the ""hero"".","Oh, mira, es la ""heroína""."
"Oh, look, the idiot. I don't want to talk to you. Go away.","Oh, mira, la idiota. No quiero hablar contigo. Vete."
"Oh, look... Another tourist.","Oh, mira... otra turista."
"Oh, look... another tourist.","Oh, mira... otra turista."
"Oh, lovely. They've sent me a mo-ron. Listen closely. You will stand guard at the hangar. This is your duty post. You will go there now and stay on guard until told otherwise. Now move it, soldier!","Oh, enternecedor. Me han mandado a una retrasada. Escucha atentamente. Montarás guardia en el hangar. Ese será tu puesto de servicio. Ahora ve allí y quédate haciendo guardia hasta que se te diga otra cosa. ¡Muévete, soldado!"
"Oh, man I can't feel my legs.","Oh, amiga, no siento las piernas."
"Oh, man. Where we going to get our shit now?","Oh, amiga. ¿Ahora dónde vamos a conseguir nuestra mierda?"
"Oh, shut up, you old bitch! It's me, your Chosen One.","Oh, cállate, ¡vieja zorra! Soy yo, la Elegida."
"Oh, so NOW you're a Citizen, huh? Just like last time? Give me those ""Citizenship papers"" and get out of here.","Oh, así que AHORA eres una Ciudadana, ¿eh? ¿Igual que la última vez? Dame esos ""documentos de Ciudadanía"" y lárgate de aquí."
"Oh, so now I'm welcome in your city? Forget this... I'm outta here.","Oh, ¿así que ahora soy bienvenida en tu ciudad? Olvídalo... me largo de aquí."
"Oh, sure. I didn't mean you could see him, now that you're a slaver and all.","Oh, claro. No quise decir que pudieras verle, ahora que eres una esclavista."
"Oh, the Chosen One. Oh my, I didn't realize. I'll just try to stop shaking long enough to tell
 you something then. (Wooz smiles) Come closer and I'll whisper it to you.","Oh, la Elegida. Vaya, no me había dado cuenta. Entonces dejaré de hacer lo que estaba haciendo para contarte algo (Wooz sonríe). Acércate, que te lo voy a decir al oído."
"Oh, yeah. You're a slaver now, eh? So what did he want? It's not going anywhere - not like it could.","Oh, sí. Ahora eres una esclavista, ¿eh? Así que, ¿qué quería? Esto no va a ir a ninguna parte... aunque pudiese."
"Oh, you mean old man McGee? He's mostly harmless. Spent near a fortune on
 that old slot machine and hasn't seen a return in years. I think it's busted. 
 Anyways... can I get you something, friend?","Oh, ¿te refieres al viejo McGee? Es prácticamente inofensivo. Gastó una pequeña fortuna en esa vieja máquina tragaperras y no la ha visto soltar nada desde hace años. Creo está rota. Cambiando de tema... ¿puedo ponerte algo, amiga?"
"Oh, you poor dear. Radiation and the wasteland aren't nice, are they? I hope someone can help you.","Oh, pobrecita. La radiación y el Yermo no son una maravilla, ¿eh? Espero que alguien pueda ayudarte."
"Oh. Okay, Boss.","Oh. Vale, Jefa."
"Oh? A wise guy, huh? Look, I'm tracing you right now, pal. We'll see how smart you feel with internal security all over your fricking ass. Dickhead!","¿Sí? Una listilla, ¿eh? Ahora mismo te estamos localizando, colega. Veremos si te haces la listilla cuando los de Seguridad te estén friendo el culo. ¡Capullo!"
"Ohh, yeah, you are the new guy in town.","Ohh, claro, eres la chica nueva en la ciudad."
"Okay, Boss.","Vale, Jefa."
"Okay, I won't, Boss.","Vale, No lo haré, Jefa."
"Okay, I'll take the disk. I'm sure that I can put it into the right hands. Goodbye.","Está bien, tomaré el disco, estoy segura de que puedo ponerlo en manos adecuadas. Adiós."
"Okay, you're clear. Open the gate, boys.","De acuerdo, estás limpia. Abrid la puerta, chicos."
"Once again my spirit [touches you] from the void, Chosen.","De nuevo mi espíritu [te alcanza] desde el vacío, Elegida."
"Once again my spirit touches you from the void, Chosen. Our crops fail, our reserves are meager. Return to us with the GECK. Your failure is our last light.","Una vez más mi espíritu te alcanza desde el vacío, Elegida. Nuestras cosechas se malogran, nuestras reservas menguan. Vuelve con el GECK. Tu fracaso será nuestro fin."
"Once again you return to us, Chosen One. Not empty-handed, I hope?","Vuelves otra vez con nosotros, Elegida. Espero que sin las manos vacías."
"Once again you return without the GECK. Our crops begin to fail us, Chosen. Our
 need becomes greater with the passage of time. Go find the holy Thirteen!","Una vez más vuelves sin el GECK. Nuestras cosechas se están echando a perder, Elegida. Nuestra necesidad se vuelve mayor con el paso del tiempo. ¡Ve a buscar el sagrado Trece!"
"One beer it is. That'll be $3, plus a $1 tip for me. That's $4, kiddo.","Una cerveza, aquí está. Serán 3 dólares, más 1 de propina para mí. Eso hacen 4 dólares, chavalita."
"One ex-gaijin, coming up!",¡Viene una antigua gaijin!
"One of your hands is very dominant.  You excel with single-handed weapons, but two-handed weapons cause a problem.","Una de tus manos es muy dominante. Eres una maestra con armas de una sola mano, pero las armas de dos manos te suponen un problema."
Only a worm like you would try for a gut-wound.,Sólo una gusanaza como tú intentaría hacer una herida en las tripas.
Ook? What do you mean by that? Are you dumb?,¿Ook? ¿Qué quieres decir con eso? ¿Es que eres tonta?
"Ooogly ann? Huh? You're just as dumb as that idiot Torr. That's good, we need a new fricking
 village idiot in town. We've just about used that Torr up.","¿Túuu feooo? ¿Qué? Eres tan tonta como el idiota de Torr. Eso es bueno, necesitamos un nuevo tonto en el pueblo. Ya estábamos aburridos de Torr."
Oooo? Bye bye.,¿Parada? Adiós.
"Ooooooh, I'm scared. Thanks for the Day Pass, pal.","Ooooooh, estoy asustada. Gracias por el pase de día, amigo."
Oops. I guess I am a bit light right now. Let me ask you something else.,Oh. Supongo que estoy un poco corta de dinero ahora mismo. Déjeme preguntarle otra cosa.
"Our life is in your hands, Chosen One.","Nuestra vida está en tus manos, Elegida."
"Our prayers are with you, Chosen One.","Nuestras oraciones están contigo, Elegida."
POISONED,ENVENENADA
"Pal, I've got no idea what you're trying to say. Sorry.","Amiga, no tengo ni idea de lo que estás intentando decir. Lo siento."
"Pal, the more I talk to you, the dumber I feel myself becoming. With an attitude like that, you
 won't be too welcome in Broken Hills. Excuse me. I have a job to do.","Amiga, cuanto más hablo contigo, más tonto me siento. Con esa actitud, no serás bienvenida en Broken Hills. Discúlpame. Tengo trabajo que hacer."
"Pal, you're not wanted here. You've done enough damage.","Amiga, no te queremos aquí. Ya has hecho suficiente daño."
Pathetic.,Patética.
Pathfinder,Pionera
"Perceptive as well as smart. I knew I wouldn't be able to pull anything on you. The catch is
 that for every brahmin you let get killed, I charge you $100. I pay well for success and I also charge
 for failure. That's the risk you take working for me.","Tan lista como perspicaz. Sabía que no podría ocultártelo. El truco es que por cada brahmin que muera, te voy a descontar 100 dólares. Te pagaré bien si tienes éxito, pero sino serás tú quien me pague a mí. Ese es el riesgo por trabajar para mí."
"Permission to speak freely, sir.","Permiso para hablar libremente, señora."
Pickpocket,Cleptómana
"Piss off, retard. I ain't got time to do sign language with you.","Vete a hacer puñetas, retrasada. No tengo tiempo de hablar con signos contigo."
Play it smart - leave before we have to get rough.,Sé lista y vete antes que te pongamos las cosas difíciles.
"Please help me, sir.","Por favor, ayúdeme, señora."
"Please stay for dinner, Citizen. Our Servant is making a delicious goulash.","Por favor, quédate a cenar, Ciudadana. Nuestro siervo está haciendo un delicioso gulash."
Pleased to meet you. So...about my offer...?,Encantada de conocerte. Y... ¿sobre mi oferta...?
Plunder!,¡Destripadla!
Poisoned,Envenenada
"Poor child. Already aligned, yet unable to articulate. Go on in.","Pobre muchacha. Ya alineada, pero aún incapaz de articular palabra. Entra."
"Powerful drink, lad! That's $5, plus a $1 tip for me, which makes it $6.","¡Bebida potente, chavala! Son 5 dólares, más 1 de propina para mí, lo que suman 6."
Prepare to be dishonored.,Prepárate a ser deshonrada.
"Primitive, eh? You. Questions? Ask me. Okay?","Primitiva, ¿eh? Tú. ¿Preguntas? Pregúntame. ¿Vale?"
Protect the Chosen One from the Spammer's idiocies!,¡Proteged a la Elegida de las idioteces del Spammer!
"Psst, straighten up, the boss's looking.","Psst, ponte derecha, el jefe está mirando."
Psycho Reliance,Adicta al psico
"Put that weapon away, pal.","Guarda ese arma, socia."
Put that weapon away.,Guarda ese arma.
"Put your weapons away, partner. You won't get any answers from me while you're waving them
 around like that.","Guarda tus armas, compañera. No obtendrás respuestas de mí mientras las muestres de esa forma."
Pyromaniac,Pirómana
RADIATED,IRRADIADA
Radaway Addiction,Adicta al Rad-Away
Radiated,Irradiada
Raul thinks you must be nuts walking around here out of uniform.,Raúl cree que estás loca yendo por aquí sin uniforme.
"Raul's going to put you in med lab, man.","Raúl te va a mandar a la enfermería, amiga."
Re-tar-dead! Pooooo!,Retra-dada! ¡Daaaaa!
"Ready to go when you are, Boss.","Listo cuanto tu lo estés, Jefa."
Ready to go?,¿Lista para continuar?
Ready to rumble?,¿Preparada para la juerga?
Ready what?,¿Preparada qué?
Real humans? What are you talking about? I'm as human as you are.,¿Auténticos humanos? ¿De qué demonios estás hablando? Yo soy tan humana como tú.
Really? That's amazing. I may have to go out there sometime and see for myself. Bye.,¿En serio? Eso es asombroso. Puede que tenga que ir por allí en algún momento y verlo por mí misma. Adiós.
"Reasonable? Reasonable! Well, I'm sure people said the Master was reasonable, too. What a bonehead. Get the hell out. Now!","¿Razonables? ¡Razonables! Bueno, seguro que la gente también decía que el Maestro era razonable. Menuda estúpida. Lárgate. ¡Ahora!"
Red mutant!,¡Mutante roja!
"Relax, pal; it's just what we call the beer here. (chuckles) This is the Golden Gecko, remember?","Relájate, amiga; es que aquí a la cerveza la llamamos así (se ríe). Esto es el Gecko Dorado, ¿recuerdas?"
"Rest in peace, Chosen One.","Descansa en paz, Elegida."
"Retracting weapon, master.","Retirando armas, ama."
"Right - obey the giant, man. It the way things are supposed to be. What should I do, giant?","Vale: obedecer al gigante, amiga. Es como se supone que deben ser las cosas. ¿Qué debo hacer, gigante?"
Right Boss. I'll hang way back.,Cierto Jefa. Me retrasaré un poco.
"Right, sure man.","Claro, por supuesto, amiga."
"Right. (shakes head) Lord, you're dumber than Hoss ever was! (sigh) There's the door.","Ya, claro (mueve la cabeza). Dios, eres más tonta incluso de lo que dijo Hoss! (suspira) Ahí está la puerta."
"Right. I'll stay here until you come back, Boss. You will come back, right?","De acuerdo. Me quedaré aquí hasta que vuelvas, Jefa. Porque vas a volver, ¿verdad?"
"Ripped my fucking leg open, you bastard!","¡Me has destrozado la pierna, puta!"
Run from the Evil One!,¡Huid de La Maligna!
"Run, it's a slaver! Ah, I crack m'self up.","¡Corred, es una esclavista! Ah, me parto."
Salesman,Vendedora
"Save the world, and Jagged Jimmy'll GIVES you the world, hero. All the Jet you need.","Salvas al mundo, y el Jeta Jimmy te ENTREGARÁ el mundo, heroína. Todo el Jet que quieras."
Savior of the Damned,Salvadora de los Condenados
"Say, you're the one who got Jack to give up, ain't you? That was good work. So what do you want?","Oye, tú eres la que hizo renunciar a Jack, ¿verdad? Ese fue un buen trabajo. ¿Qué quieres?"
Scout,Rastreadora
"Scramble, boys, we got an intruder!","¡Dispersaos, chicos, tenemos una intrusa!"
Screw you! You're not my boss. You're not the boss of me. I'm the fucking boss of ,¡Que te jodan! No eres mi jefe. Yo soy la puñetera jefa de 
Scrounger,Gorrona
"Security, please remove our ""guest"".","Seguridad: por favor, ocupaos de nuestra ""invitada""."
"See I only take from the cars I ain't paid to watch. He thinks I'm jacking my customers, but I don't do that. Man, I got to quit talking. I'm like seeing things...oh, man, the glow. It's all about glowing.","Verás, sólo me guardo cosas de los coches que no me pagan por vigilar. Él cree que estoy timando a mis clientes, pero yo no hago eso. Amiga, tengo que dejar de hablar. Me gusta ver las cosas... oh, amiga, el resplandor. Todo resplandece."
"See, Boss! You can teach an old dog new tricks!","¡Mira, Jefa! ¡Se le puede enseñar a un perro viejo nuevos trucos!"
Seek a reflection of yourself. The pathway will open before you.,Busca un reflejo de ti misma. La senda se abrirá ante ti.
Selfish bastard. I'll bet Chip would've helped you.,Zorra egoísta. Apostaría a que Chip tu hubiera ayudado.
Sergeant Stark... sir. Did you need something?,Sargento Stark... señora. ¿Necesitaba algo?
"Several years after buying the Excavator Chip from the Chosen One, Marge LeBarge was able to purchase and control both the Morningstar and the newly opened Kokoweef mines.","Varios años después de haber comprado el chip de excavación a la Elegida, Marge LeBarge pudo adquirir y controlar tanto la mina Morningstar como la, de nuevo abierta, mina Kokoweef."
"Several years after the Chosen one sold the Excavator Chip to Dangerous Dan McGrew, Dan used the superior production of his Morningstar Mine to buy the Kokoweef mine and then to reopen the Great Wanamingo Mine.","Varios años después de que la Elegida vendiera el chip de excavación a Dañino Dan McGrew, Dan usa la superior producción de su mina Morningstar para adquirir la mina Kokoweef y a continuación reabrir la gran mina Wanamingo."
Sharpshooter,Tiradora
Shit. You called my bluff.,Mierda. Me has llamado faroleadora.
Shit...this tribal hits like the Masticator...,Mierda... esta tribal golpea como el Masticador...
"Simple. They wouldn't BELIEVE you. You're an Outsider, I'm a Citizen. Guess whose word they're going to believe?","Sencillo. No te CREERÍAN. Eres una forastera, yo soy Ciudadano. ¿A quién crees que iban a creer?"
Sir! What is your business here?,¡Señora! ¿Qué hace aquí?
"Sir, [cough] can you help a poor man down on his luck?","Señora, [cof] ¿puede ayudar a un pobre hombre con mala suerte?"
"Sir, this is your final warning. I have to ask you to leave this area.","Señora, este es el último aviso. Tengo que pedir que abandone esta zona."
"Sir, yes, sir!","¡Señora, sí señora!"
Sir.,Señora.
"Sir. It's good to see you, sir.","Señora. Me alegra verla, señora."
"Sir... yes, sir... goodbye, sir.","Señora... sí, señora... adiós, señora."
"Sister, I don't know NOTHING about your car. ","Hermana, no sé NADA sobre tu coche. "
Sit-Zen?,¿Ci-Ciu-dana?
Skag!,¡Colgada!
Skilled,Habilidosa
Slayer,Asesina
Sloppy...,Chapucera...
Slow...,Lenta...
"Slumming, Citizen?","¿Visitando los barrios bajos, Ciudadana?"
Small Frame,Canija
"Smart as whip! You remind me of myself when I was young. Simple... some wild dogs have been
 coming down out of the hills lately looking for food. I think they find brahmin easy prey and have been
 attacking my herds nightly. Wipe out their pack, and I'll give you $1000.","¡Muy lista! Me recuerdas a mí cuando era joven. Es simple... últimamente, algunos perros salvajes han estado bajando de las colinas buscando comida. Creo que han descubierto que los brahmines son presa fácil y han estado atacando al ganado por la noche. Deshazte de su manada, y te daré 1.000 dólares."
Smooth Talker,Charlatana
Sniper,Francotiradora
So be it. Zomak! Kill this fool for me. But be careful with the Cheezy Poofs!,Que así sea. ¡Zomak! ¡Mata a esta idiota por mí! ¡Pero ten cuidado con las bolitas de queso!
"So good of you, my dear fellow. [He takes your hand and walks you to the garden.] Wouldn't want
 you to get lost. Come back and see me when you finish killing the pests.","Bien por ti, querida amiga. [Te toma de la mano y te lleva hasta el jardín]. No quisiera que te perdieras. Vuelve a verme cuando hayas acabado con la plaga."
"So how about you and me doing a film? I'll treat you right, chica. I show you what a Latin lover can do.","Entonces, ¿cuándo vamos a hacer tú y yo una película? Te trataré bien, chica. Te demostraré lo que puede hacer un latin lover."
"So man, you want my protection?","Entonces, amiga, ¿quieres mi protección?"
"So there you are, Chosen One. Hmmmph! How goes your quest?","Así que estás aquí, Elegida. ¡Hmmmph! ¿Cómo va la búsqueda?"
So what do I do now that I'm an Hubologist?,"Entonces, ¿qué voy a hacer ahora que soy una Hubologista?"
"So you lookin' to celebrate with some Jet, hero? You came to the right place. For you, EVERYTHING'S on special.","¿Así que estás buscando celebrarlo con algo de Jet, heroína? Has venido al lugar preciso. Para ti, TODO está a precio de ocasión."
"So you lookin' to party with some Jet, friend? You came to the right place. For you, EVERYTHING'S on special.","¿Así que quieres montarte una fiestecita con algo de Jet, amiga? Has venido al lugar preciso. Para ti, TODO está a precio de ocasión."
"So you still choose to be an ass. (Gordon motions toward the Deathclaw guard) Guard, please take
 out the trash.","Así que sigues eligiendo ser una tonta. (Gordon se dirige al guardia Garra mortal). Guardia, por favor saca la basura."
"So you think you're tough? I'm gonna wipe your ass all over the floor. Bare fists, right here, right now.","¿Así que te crees muy dura? Voy a fregar el suelo con tu culo. Prepara tus puños, aquí y ahora."
"So you're the new guy, eh?","Así que tú eres la chica nueva, ¿eh?"
"So, changed your mind? Ready to prove your worth?",¿Así que has cambiado de opinión? ¿Lista para demostrar tu valía?
"So, child. Once again you stand before me. Are you empty-handed yet again?","Bien, chiquilla. De nuevo estás ante mí. ¿Otra vez con las manos vacías?"
"So, friend, have you reconsidered?","Así que, amiga, ¿lo has reconsiderado?"
"So, here you are at last. The savior of the downtrodden, the righter of wrongs, the icon of
 hope for humanity. What a dumb-ass! Well, before you start any boring speeches, I'd just like to say
 that I'm not fucking interested. Let's just cut to the chase and get this over with. Baddog, kill!","Así que aquí estás por fin. La redentora de los oprimidos, desfacedora de entuertos, símbolo de esperanza de la humanidad. ¡Menudo idiota! Bueno, antes de que empieces uno de tus aburridos sermones, me gustaría decirte que me la suda lo que digas. Dejémonos de tonterías y acabemos con esto. ¡Perro malo, mata!"
"So, that it, stranger?","¿Y entonces qué, forastera?"
"So, you're a coward too? Figures.","Así que, ¿tú también eres una cobarde? Ya me lo figuraba."
"So, you're my next organ donor huh?","Así que, ¿eres mi nueva donante de órganos?"
So... you're Citizen ,Así que... eres la Ciudadana 
Solar plexus... eegad that hurts!,Mi plexo solar... ¡eso sí que duele!
"Somebody done smashed up my still! And you're the only person I told about it. Why, if I were
 a younger feller, more full of piss and vinegar, I'd have a mind to teach you a lesson. Just get out of
 my sight, you double-crosser!","¡Alguien me ha destrozado el alambique! Y eres la única persona a la que se lo había contado. Si fuera más joven, y tuviera la energía de antes, te enseñaría una buena lección. ¡Sal de mi vista, traidora!"
"Someone new. Hey, this is a private matter! Let's get 'em!","Alguien nuevo. ¡Eh, ésta es una cuestión privada! ¡Vamos a por ella!"
Something I can help you with...Outsider?,¿Puedo ayudarte en algo... forastera?
Son of a pig! Die!,¡Hija de una cerda! ¡Muere!
"Son, I can tell from the smell that you're not wearin' one of them powered armor suits.
 If the Sarge sees you out of uniform you're screwed. And I ain't talking the type of screwing that feels good. Now get your ass down to supply and suit up.","Hija, puedo decirte por el olor que no estás llevando una de esas servoarmaduras. Como el Sargento te pille estás jodido. Y no hablo de la jodienda que da gustito. Ve cagando leches a intendencia y vístete."
Sorry Boss.,"Lo siento, Jefa."
Sorry stranger. I don't have time to chat with you.,"Lo siento, forastera. No tengo tiempo de charlar contigo."
"Sorry, I'll try to be more civil.","Lo siento, intentaré ser más civilizada."
"Sorry, Torr. I'm too busy to stand around with a bunch of brahmin, whether they've got two legs
 or four.","Lo siento, Torr. Estoy muy ocupada para quedarme aquí con un montón de brahmines, tengan dos o cuatro patas."
"Sorry, fren.","Lo siento, miga."
"Sorry, friend, I can't take much more of this...","Lo siento, amiga, no puedo resistir más..."
"Sorry, pal, we've already got enough throwbacks working in this caravan.","Lo siento, amiga, ya hemos tenido suficientes malas experiencias trabajando en esta caravana."
"Sorry, stranger. I don't have time to chat with you.","Lo siento, forastera. Ahora no tengo tiempo para hablar contigo."
Speaker,Oradora
"Spirits want out of skull, oh mahn de skull hurt!","¡Espíritus quieren salir de calavera, oh miga, calavera duele!"
"Spreading out, Boss.","Distanciándonos, Jefa."
Stand still and I'll get this over real quick for you.,Quédate quieta y esto acabará enseguida.
"Standing back, Boss.","Me quedo atrás, Jefa."
Star Father! Save me from the heathen!,¡Padre Estelar! ¡Líbrame de la pagana!
Stay outta that man's path.,No te interpongas en el camino de esa mujer.
"Step back, outsider.","Un paso atrás, extranjera."
Step slowly away from that. Make a move for your weapons and you're dead.,Aléjate de eso muy despacio. Amaga con alcanzar tus armas y estás muerta.
"Stop right there, friend. No one is allowed past this point without proper authorization.","Quédate justo ahí, amiga. No se permite el paso más allá de este punto a nadie que no tenga una autorización adecuada."
Stranger!,¡Una extraña!
"Stranger, NCR's got laws and one of them's ""No weapons.""  Put it away and there'll be no trouble.","Extranjera, la RNC tiene leyes y una de ellas es ""Sin armas"".  Guárdalas y no tendremos problemas."
"Stranger, we got a no weapon policy in this town. Put your weapon away.","Forastera, tenemos un política de no armamento en esta ciudad. Guarda tu arma."
"Stripling, you have a lot to learn about respect.","Jovencita, tienes mucho que aprender sobre el respeto."
Strong Back,Mula
Sucker.,Zorra.
"Suffer, foe!","¡Sufre, enemiga!"
"Suffer, human!","¡Sufre, humana!"
"Sure is. I was interested in something else, though...",Seguro que lo es. Pero estaba interesada en alguna otra cosa...
"Sure thing, Boss.","Claro que sí, Jefa."
"Sure thing, Chief!","¡Claro, Jefa!"
"Sure you are. I'd just be careful who you say that to, ""Citizen."" Somebody's gonna recognize whatever stolen papers you bought from that bloodsucker Skeev. So keep your head down, all right?","Claro que lo eres. Yo tendría cuidado de a quién le dices eso, ""Ciudadana"". Alguien podría reconocer esos documentos robados que has conseguido de ese chupasangres de Skeev. Así que mantén la cabeza baja, ¿de acuerdo?"
"Sure, Boss.","Claro, Jefa."
"Sure, Boss. Anything else?","Claro, Jefa. ¿Algo más?"
"Sure, Boss. I'll take some.","Claro, Jefa. Me tomaré algunas."
"Sure, dude, take it all.","Claro, amiga, quédatelo todo."
"Sure, handsome.","Claro, guapa."
"Sure, stranger, what do you want to know?","Desde luego, forastera, ¿qué quieres saber?"
Sure. Why the hell not? You look like you know how to take care of yourself in a fight.,Claro. ¿Por qué no? Tienes pinta de saber cuidar de ti misma en una pelea.
"Surely you remember it is to the northeast, foolish one.","Seguramente recuerdes que está al nordeste, necia."
